"","category","name","reviewer","reviews","verified","date.of.review","ratings"
"45","Electronics","Meta Quest 2 — Advanced All-In-One Virtual Reality Headset — 128 GB","Rob Burgess","After all my research on the Oculus Quest 2, Amazon Prime was the best possible deal. The price may sting for some, I was lucky enough to have a gift card to help me out. The experience for what you get out of it is worth it though.It's absolutely true that the headset strap is hella uncomfortable after playing for some time and troublesome to adjust but there's an alternative you can buy - the elite strap. My purchase included the silicone cover which I completely forgot to put on the foam pad, so I can't quite say yet how that feels like but anything is better than the default foam pad.Another negative jab is at Facebook itself. There does not seem to be a way to play the Oculus without having a Facebook profile. This shouldn't be forced upon users who wish to play a VR headset and have fun. At the end of the day, Facebook (or should I say Meta) has implemented this to help improve the product. There is no need to worry about privacy as you can hide your activity in your settings.I bought Resident Evil 4 VR for this headset and it'll be the only game I buy on the Oculus. There's no shortage of games but they are pricey and it's still early days for their library. The rest of my VR games will be played on Steam using the Oculus Quest 2.","Verified Purchase","Reviewed in Australia on 18 March 2024","5.0 out of 5 stars"
"46","Electronics","Meta Quest 2 — Advanced All-In-One Virtual Reality Headset — 128 GB","tekno","My son loves this it's awesome grafhics are great","Verified Purchase","Reviewed in Australia on 6 December 2023","2.0 out of 5 stars"
"47","Electronics","Meta Quest 2 — Advanced All-In-One Virtual Reality Headset — 128 GB","Sean","I always thought VR was a gimmick until I tried this out in a HCI class and wrote software for it. Decided to purchase a unit for myself, played with it for a bit and eventually sold it as I don't have much time for gaming.Brilliant piece of technology that I would recommend to casuals/normies and gamers who haven't yet experienced VR.Old people beware! I let a lot of people I know try out this headset and guided them through the process of setting up their play area and starting the demo. It has been overwhelming for half of the old people (VR anxiety?) and a joy for the others.","Verified Purchase","Reviewed in Australia on 1 November 2021","5.0 out of 5 stars"
"48","Electronics","Meta Quest 2 — Advanced All-In-One Virtual Reality Headset — 128 GB","Vicki","Great value and lots of fun but getting the fit just right so that the image isn’t blurry is very tricky and if it shifts slightly out of place the view goes blurry.Games are still quite simple and basic, better games are expensive. The immersion is impressive but the resolution is very low compared to a PS4 or similar.If you don’t get the expensive extended battery pack you won’t get much game time before having to charge it again.","Verified Purchase","Reviewed in Australia on 31 December 2023","5.0 out of 5 stars"
"49","Electronics","Meta Quest 2 — Advanced All-In-One Virtual Reality Headset — 128 GB","David","This is great, walthough we never got the $100 Amazon voucher like was promised with their promotion. Disappointing. The headset stinks after playing beat sabre and there is no way of cleaning it. After just a few months, limited usage now because of the smell.. the hand grips/controllers also started glitching after a year. Can't buy new hand grips separately apparently. That's unfortunate","Verified Purchase","Reviewed in Australia on 19 July 2023","5.0 out of 5 stars"
"50","Electronics","Meta Quest 2 — Advanced All-In-One Virtual Reality Headset — 128 GB","Neil","The VR is so fun! I cannot stop playing! I highly recommend this VR to anyone.","Verified Purchase","Reviewed in Australia on 14 October 2023","5.0 out of 5 stars"
