"","Reviewers","Reviews","Ratings","Date","TextReviews"
"92","keng5"," Doing justice to Jane Austen.","10/10","23 May 2005","This is a drama to rave about. I've not seen its like on television before; nor do I expect to see its like again. It was superb. It was almost perfect - though not quite.It is rare to find a Jane Austen dramatisation that comes so near to being perfect on every level and that stays so true to the original novel. The greater part of the dialogue in the series is Jane Austen's own and every scene is included and follows the same chronological order. The drama departs from the novel in only two instances. In order to extend our knowledge of the characters of Darcy(Colin Firth), and Mr Collins(David Bamber), two scenes are added; to demonstrate that Darcy is not just an effete aristocrat but a real man worthy of Elizabeth's love we are shown him indulging in manly pursuits; fencing, and swimming in his private lake (it puzzles me why so many women seem to drool over his wet-shirt scene); and to demonstrate that Mr Collins is an idiotic, narrow- minded prude we are shown him trembling with embarrassment and horror when he happens to come across Lydia (Julia Sawalha) in a state of dishabille. David Bamber makes Mr Collins deliciously toadying and obsequious. A remarkable piece of acting.It is its faithfulness to the original that makes this drama so good. No one has ever written a more tightly plotted novel. Its series of climaxes make the novel difficult to put down; just as one plot-line reaches its climactic conclusion, another is building. And the duel of wits and sharp dialogue between Darcy and Elizabeth (Jennifer Ehle) as they get to know each other is entrancing. And then comes that moment. She is at the piano befriending Darcy's sister, Georgiana (Emilia Fox), when he holds her gaze with a silent declaration of his love and admiration. This involved a fine piece of editor-timing; a split second either way, either too long or too short, and the poignancy of that moment would have been lost. It is interesting to compare Colin Firth's Darcy with that of Lawrence Olivier's Darcy in the Hollywood film. Olivier falsely portraits him as appealingly shy and self-conscious. But Darcy was in no way shy, he was just proud, with every reason to have a good opinion of himself. He found it impossible to imagine that anyone in a lower strata of society, living in a small provincial town, could be his equal - until he met Elizabeth!However, I felt there was one weak link in the chain of superb acting; Alison steadman. Many will disagree but I think she over-acted, turning her Mrs Bennet into a nerve- grating, neurasthenic caricature. But apart from that, I heartily recommend this video. Don't miss it. You'll not see its like again. I must just mention the charming piano music by Carl Davis, so beautifully evocative of a beautiful period in history (for the rich)."
"93","k-king2"," A masterpiece!","","12 July 2004","First let me state that I am a 30 something male who generally does not like chick flicks.  I have not seen any other version nor read the book.
The mini-series is just perfect.  It is a fantastic love story that is witty, charming, and very funny.  I am not sure how many times I have watched it now, at least 5, and it improves with each viewing.  The story and characters are so rich and interesting and the acting is just superb.  I have a Top Ten list of movies/shows based on the premise that you are stuck on an island and can only bring 10 movies with you to watch for the rest of your life.  This version of Pride and Prejudice has a permanent spot on that list.  I rarely give 9s when voting here and I give this a 10! 
If you like period pieces, good acting, or a great love story then this is a must see!"
"94","Tom_Benton"," Quite simply the most flawless thing I've ever seen.","10/10","29 June 2004","Much had I heard of Jane Austen's legendary classic, ""Pride and Prejudice"", and so to kick off my summer I set about reading it. It was possibly the greatest book I'd ever read. I looked up the different screen adaptations of it, and found that Colin Firth had starred in one (I previously enjoyed him in ""Bridget Jones's Diary"" - which is, in fact, a semi-remake of Austen's tale - and ""Love Actually""). So I traveled to my handy-dandy Borders store and picked up a DVD copy. As I walked out of the store, I hoped that I hadn't wasted $40 for this thing. And you know what?It was worth every last penny.""Pride and Prejudice"" is quite simply the most flawless thing I've ever seen. The story involves Elizabeth Bennet (Jennifer Ehle), who's opinion changes greatly of a seemingly very proud, rude man that moves into town. To sum up the whole story would be impossible, as there isn't really a simple lot.First of all, let's examine the overall look of the thing. Simon Langton's direction is excellent, and he succeeds in getting the most breathtaking views of everything and anything. The production design and costuming is perfect, capturing the time without error, and the locations are simply gorgeous. Carl Davis' score is terrific and fitting (also to the times). Andrew Davies' script brings every last scene from the book and then pops in some new, being as absolutely faithful to the book as anyone could hope to be.But now on to the casting. The cast is outstanding, although the film's one problem (albeit a very slight one) is the role of Mrs. Bennet, who - although wacky in the book - is completely over-the-top here and quite frequently even annoying. But the stars of the film couldn't be better. Jennifer Ehle is absolutely wonderful as Lizzy Bennet, and her eyes are so dazzling that they mesmerized me throughout the whole 300 minutes! The show is completely stolen, however, by Colin Firth as Mr. Darcy. Colin Firth is not just playing Mr. Darcy; Colin Firth IS Mr. Darcy. He was born to play this role, and plays it so flawlessly, that it deserves to be considered one of the best performances any actor has ever given. Words cannot describe Firth's perfection as Darcy.All in all, ""Pride and Prejudice"" is the greatest thing ever to air on television, and were it a film, it would be the greatest film of all-time. Those of you who have read the book shouldn't worry a bit about the long running time of the mini-series; as impossible as it seems, you shan't even notice. When I finished the series, I had such a feeling of satisfaction as no entertainment has ever before granted me.This is perfection."
"95","nycritic"," The BBC Version","","12 April 2006","At 300 minutes, it might seem a bit steep to sit through -- after all, the novel is barely under 400 pages and its plot is concise enough to garner a shorter transition from book form to images. But, when you sit and read PRIDE AND PREJUDICE, widely considered to be Jane Austen's magnum opus, and savor its miniaturist style, its sharp language, the treatment of even its minor characters as a huge tapestry, there is no other way to create a complete vision of the novel but to do a televised re-working of her novel. (The advent of Emma Thompson and the 2005 movie now proves otherwise.) The interesting aspect of the miniseries is that it never feels like it's moving at a crawl. The story of Austen's micro-society develops at its own pace, much like the novel: it's as if the novel had literally come alive and were being acted by the people from FAHRENHEIT 451, complete with costumes and settings. We meet the Bennets right at the beginning when they discuss how Netherfield is to be let at last, and that its owner is none other than an eligible bachelor. Elizabeth, the second eldest Bennet herself is the one who utters the opening line of Austen's book -- and it's appropriate that she be the one who does so: listen to how she says it, not to when she does or who she does to.The arrival of such a man causes an uproar it the small community. Charles Bingley is a congenial man, personable, but has some odious sisters, Caroline and Louisa Hurst. His friend, Mr. Darcy, is also eligible and ten times richer than Bingley, but is soon to be revealed to be someone disagreeable. At the ball, Jane Bennet becomes close with Charles (much to her mother's delight) and Elizabeth seen to be a little taken with the imposing nature of Darcy, but his aloof nature and continuous rebuffs, plus a harsh commentary he makes of her within earshot hurts her deeply: her pride has been hurt; hence, from now on, she will have nothing to do with him.But fate has her meet him again when Jane falls ill after she gets called to spend an evening with Bingley and his sisters. While Darcy seems to be taking a repressed liking to Elizabeth, she is unaware of it, and grows increasingly hostile towards him, particularly after learning from George Wickham that he behaved quite badly towards him. In the middle of this, and because the Bennets have no son, the girls stand no chance of inheriting. Their property has been entailed to a male heir. Reverend Collins comes looking for a wife, proposes to Elizabeth, gets rebuffed, and winds up marrying Charlotte Lucas -- Elizabeth's best friend. On top of this, the Bingleys leave Netherfield, and Jane's future is left up in the air.Eventually the plot reaches a head, and like the novel, it occurs midway. Jane Austen must have been aware at an empiric form that editing can balance out a work and enhance its effect, because in putting the crisis of the action halfway she establishes that Elizabeth and Darcy will have to shift towards each other in a realistic way, the same way other events will allow Jane and Bingley to consummate their union. This is what makes this story so enduring -- everything in it is realistic as possible, adhering to what society's attitude towards woman and men of their time was, where marriage was taken as serious as a retirement plan or having medical benefits. The miniseries captures the slow breakdown of Austen's plot in a way that could have been stagy but is not. Not one thread is left untold, unlike the 1940 version (despite the presences of Laurence Olivier and Greer Garson) where the story looked a little more like farce and characters in the book behaved much differently in that film version. Jennifer Ehle and Colin Firth are perfect in their renditions of Elizabeth and Darcy. She resembles an earthier version of Meryl Streep down to her voice and mannerisms; he is as aloof as alluring. Who wouldn't believe they didn't have what it took to merge together? Both have to do much acting without expressing much if at all, yet Ehle brings a nice iconoclastic attitude towards her character, the same way Firth embodies masculine arrogance.Now, with the 2005 film version having got the praise it did, there will be people who prefer this version to the movie version and vice versa. There may be Olivier purists who will balk at such a long version. Having read the novel several times, I can relate to this one best because it retains pages of dialog intact without making it too talky and that's a tricky thing to do. Minus Alison Steadman's character, everyone is at a uniform level, but Steadman is a shade too shrill. While Mrs. Bennet wasn't the most agreeable person in the world, I believe that she has been represented better in the movie version because while still being a hyperactive, over-emotional woman, she was aware her daughters would be left destitute if they did not marry well. Even so, she does have a delicate tightrope to walk and I found myself liking Mrs. Bennet in the end and understood she was also a part of this enormous tapestry that Austen herself had woven so lovingly."
"96","Adriane"," Very true to the book (that's why it was worth watching)..","10/10","30 April 2001","I am a college student and I love reading classic literature. Jane Austen is one of my favorite writers of all time, and I was very happy with the movie versions of both Emma (with Gwyneth Paltrow) and Sense and Sensibility (with Emma Thompson & Kate Winslet). Both of the books are classics, and the movies are very true to their predescesors. This was no exception. I have read the book, and loved it, and I absolutely loved this mini-series. I was told by my English professor that it was the best version, and I was not happy with the version with Laurence Olivier. The cast was perfect, and how I loved seeing the relationship between Elizabeth & darcy unfold! One of the best 5 hours ever spent on a movie. 10/10"
"97","planktonrules"," Perfection.","","30 September 2012","Having read Jane Austin's novel and seen several other versions of the story, it's easy to believe that I adored this 1995 mini-series. Most of it is because Austin's book is one of the best and most beloved of the 19th century--and all the films try to cram all this wonderful material into only two hours (more or less). You simply cannot rush the great story and so many plots and subplots are omitted or rushed in other film versions. Here, however, there is five entire hours and the story is given what it deserves. It also deserved wonderful locations, acting, costumes and a screenplay--all which it has here.My advice is to see the other film versions--they're all pretty nice (even the Bollywood film ""Bride and Prejudice""). Then, buy yourself a copy of the 1995 mini-series, curl up and give it your undivided attention. Don't be surprised if five hours later you are finishing the film and using a few Kleenex! See this film!"
"98","denis888"," Classical masterpiece made a fantastic movie","10/10","11 July 2006","If there's a film that may be voted one of the best screen adaptations, then Pride and Prejudice is the one. From the very beginning, from the opening captions and sounds of the clavichord, you are tuned to a wonderful atmosphere of the 19th Century Britain. Everything is a winner in this excellent serial. Think of Mr. Bennet Â– cold, reserved, true English gentleman, kind at heart and somewhat ice on the surface. Think of absolutely unbeatable Miss Elizabeth Bennet, played by Jennifer Ehle, and here you see the marvelous portrait of a witty, smart, clever lady in full glory. And do not forget of Mr. Darcy, mastered by excellent Colin Firth Â– what a brilliant role! He looks so proud, so conceited at first, but then, as the film progresses, he warms up a little and becomes a charming elegant knight. One of the best roles is there of Mrs. Bennet, she is so convincing that you almost have to pinch yourself reminding that it is only a film! Every part in the film Â– Lady Catherine De Burgh, Lydia, Kitty, Jane, and Mr. Bingley Â– is excellently chosen and played with an exquisite touch that says much about the classical British film school. Scenery is another achievement here, one may only admire and contemplate over the majestic hills, green pastures and severely looking castles all around. Dances, costumes, music, mimic, manners, even language and food Â– all is executed with a precision that awakes admiration only. Solid 10 points Â– a masterpiece!"
"99","Red-125"," Excellent version of a great novel","","29 January 2017","""Pride and Prejudice"" (1995) is a BBC TV mini-series directed by Simon Langton. Pride and Prejudice is probably Jane Austen's most popular novel, and it comes to life in this film. (If you haven't read the novel, I would try to find a synopsis. The plot is complicated. Characters appear and you're not always certain where they fit in, or to whom they are related.)Jennifer Ehle portrays Elizabeth Bennet, the second of the five Bennet sisters, and the one with the most intelligence and the best grasp on reality. Susannah Harker plays Jane Bennet, also intelligent, but more gentle and loving than her younger sister. There are three other sisters, but only one of them figures prominently in the plot. Alison Steadman portrays Mrs Bennet, who is extremely foolish, but, in truth, is sometimes right.Important male characters are Benjamin Whitrow as Mr Bennet, who has not an ounce of romance in him, but respects his two older daughters.The male characters include Colin Firth as the brooding, fabulously wealth Mr. Darcy. Crispin Bonham-Carter portrays Mr. Bingley, also rich, but under Darcy's spell. Adrian Lukis is Mr. Wickham, who is able to charm everyone, until they know him better. David Bamber is the insufferable Mr. Collins.No one can deny the greatness of Jane Austen's book, and I think it will be considered a masterpiece as long as people read English novels. For IMDb, we reviewers have to review the film version of the novel. How well did the director and the actors reflect Austen's written word?I think that this version is a wonderful interpretation of the novel. The plot revolves around Elizabeth, and I think Ehle's portrayal is masterful. In the novel, she is considered attractive, but not conspicuously beautiful. (Jane is considered the great beauty.)What makes Ehle's acting wonderful is the expression in her eyes, and her beautiful smile. That smile tells us of her character. It's not a full cheerful smile--it's the smile of a woman who knows what is happening to her, and around her, and smiles in understanding.Colin Firth is an excellent actor. Maybe he broods a little too much, but who can say whether Jane Austen had that much brooding in her mind when she wrote her novel. One of our friends told us that the moment when Firth emerges from swimming in the lake, with his elegant white shirt clinging to his body, represents one of the great iconic moments of BBC television. I can accept that.We saw the film on the small screen. It was made for television, so clearly it should--and does--work well. However, if it's ever shown in a theater, I'd go to see it on the large screen. That's because the BBC production values are so high that the colors and scenery of the countryside would be shown to better advantage on a large screen.This 1995 P&P is a longer and better version of the 1980 version that I've also reviewed. However, the earlier version also has a great many good points. My suggestion--see them both."
"100","voltage11"," Capital! Capital!!!","10/10","1 May 2005","You just don't get much better than Pride and Prejudice, whether you're reading the book or watching the mini-series. I first saw P&P about four years ago, and it was my first taste of Jane Austen. It opened the world of classic literature to me and film adaptations of those classics.Now, of course, five and a half hours is a LONG time...but all the more to sit through! When you love something, it's fabulous to have it extended for as long as possible. This version is right on with the book; the conversations were practically ripped from the pages. If you've been a faithful fan of the book, you can rest easy that this is a faithful adaptation.As for the actors, it's hard to find anything bad to say. Jennifer Ehle and Colin Firth portrayed Lizzie and Mr. Darcy perfectly, and I have no qualms with putting their faces to the characters when reading the book. In fact, I can't think of one person I could complain about...they were all well suited.This is very light-hearted, wholesome entertainment that has become a favorite of nearly everyone who I've seen it with...including my dear dad. Well, not a favorite for him, but he enjoyed it very much! If you don't think you can sit for almost 6 hours, take it in spurts...although I have yet to see a friend ask me to stop if from boredom. Even my sister's ex-boyfriend sat through all 6 hours and enjoyed it. We've been lucky with men around here, apparently. ;) If you enjoy this, I also recommend Sense and Sensibility. Happy viewing!"
"101","nowego"," Perfection","","6 February 2011","This is one of the few series that I have been able to watch multiple times and not get bored. I am a 40+ male and I have watched this series many more times than my wife. She has watched it once and I have seen it at least 10 times.This is as close to perfection as you can get on many levels. I have read the book a few times and this adaption is so faithful to the book it could not have been done better and hasn't to date in my opinion.The casting is spot on and after seeing all of the other versions of Pride and Prejudice in movie form I cannot see anyone else playing Darcy other than Colin Firth and Jennifer Ehle is flawless as Elizabeth. Alison Steadman as Mrs Bennet and David Bamber as Mr Collins are just sublime. There are many other fantastic actors and characters who just make the series what it is, a must watch for anyone who likes period pieces, but it is also a must see for almost anyone with a brain, there is something in this for everyone no matter what age.This is 300 minutes of exquisite entertainment. 10 out of 10 for me."
"102","knightsofneech"," Probably the best BBC miniseries made-Austen would be proud...","10/10","20 September 2004","This adaptation of the Jane Austen novel is really incredible. Set design and costumes are very believable and the acting is practically perfect for most of characters.A few comments on costume: one of the most believable aspects of the details put into this miniseries has to do with the costumes. Elizabeth and Jane are both adorned simple enough to convey a Christian background and some decor and modesty, as they would have properly been dressed during this time, yet the costumers could have expanded their wardrobe as you see many times in American films (the 1999 version of Emma comes to mind here, particularly) and yet at the time, the women would *not* have had 10 different ensembles to wear at special events. I honestly admired the holding back of their wardrobes to a few gowns rather than having gone overboard as you often see! The women who were of higher stature were properly attired in their jewels and every costume fit the character and situation beautifully. This and the musical score are two of the biggest highlights, I felt.I would also like to give props to Jennifer Ehle and Colin Firth who were cast wonderfully. Jennifer was able to convey a sort of devilish satire and quick wit which I thought suited her exceedingly well and accentuated the wit Austen was trying to get across in the novel. Firth held back and it suited his character. He shows a quiet power, a feeling of disdain and complexity in his acting that worked well for the first half of the miniseries and then turned this into admiration and openness later as the story develops. By the time he declares his undying love to Elizabeth you get the impression he is ready to burst open and you breathe a huge sigh of relief for him, yet the energy continues to pulse. Its a great thing to watch..I would recommend this miniseries to anyone, especially those not yet familiar with Austen. This specific miniseries is so well done many people I have watched it with have sparked incredible interests in the intrigues of Austen's works. Good job BBC!"
"103","lauraeileen894"," Definitive Jane Austen adaptation","","3 June 2007","The BBC miniseries version of ""Pride & Prejudice"" will undoubtedly be the yardstick by which all Jane Austen adaptations will be measured. Oh, there have been plenty of entertaining adaptations since then, such as ""Sense and Sensibility"" and the 2005 version of ""P&P"" with Keira Knightley, but it's safe to say that the classic miniseries is the definitive adaptation of a Jane Austen novel. Director Simon Langton captures the essential wit, satire, and suspense of Austen's most character-driven story. Twinkly-eyed, rosy-cheeked Jennifer Ehle makes a delightful Elizabeth Bennett, and she perfectly embodies Elizabeth's finest qualities: cool-headed, headstrong, witty and passionate. Elizabeth deserves to be placed in the same category of strong literary heroines such as Jo March and Scarlett O'Hara. You come to love Elizabeth as you watch her escape an engagement to the repulsive, simpering Mr. Collins (David Babson) and maintain her sanity among her foolish family members, including her hysterical mother (Allison Steadman) and her vapid, boy-crazy youngest sister Lydia (Julia Sawalha, playing the antithesis of her character from ""Absolutely Fabulous""). The supporting cast is also delightful, including Susannah Harker as Elizabeth's serene and lovely sister Jane, Crispin Bonham Carter as Jane's cheerful suitor Mr. Bingley, and Benjamin Whitrow as cynical Mr. Bennett.But let us not forget the real highlight of ""Pride and Prejudice"": Colin Firth's star making turn as the misunderstood (but no less dashing) Mr. Darcy. Elizabeth initially dislikes Mr. Darcy, but is surprised to find that he improves ""on closer acquaintanceship"". Firth plays Mr. Darcy as a man who is uptight and priggish on the outside, but warm, passionate, and romantic on the inside. Plus, it helps that Firth is criminally handsome and has soulful brown eyes that could melt even the coldest heart (oh, I'm such a girl!). The kiss at the end is one of the tender, romantic kisses I've ever seen on screen""P&P"" remains true to the spirit of Austen's story, so it doesn't pander to modern audience's expectations (if your tastes run towards explosions and sloppy sex scenes, this is not for you). Yet it remains delicious entertainment for people willing and patient enough to give it a try. Jane Austen, obviously, never lived to see her books made into film, but I think it's safe to say this brilliant miniseries would have made her glow with, well, pride."
